id,category,category_name,type,name,avatar,badge,abstract,sale_status,rating,subject,program_tag,description,price_normal,price,status,pmo_id,tag,slug,linier,max_quota,current_quota,enrolled,creator
1543,2,KELASMU,1,Sekolah Cikal - TK B - Bahasa Inggris,,,"Do you want to learn more about English in a fun way by listening to stories, watching videos or playing online games? Join us please",,,"[{'id': 1338, 'subject_id': 91, 'subject_name': 'Bahasa Inggris'}]",[],"<p>Howdy Kiddos! :) How are you today? Welcome to our English program! In this program, you will have so much fun learning English using various resources such as storybooks or videos to help you to get more exposure with the English Language. You will also improve your skills in reading, writing, listening, and speaking as well as enhance your vocabularies in English. Have Fun!</p>",0.00,0.00,True,,"[{'id': 1750, 'tag': 'Murid', 'title': 'Murid'}]",TKB-bahasa-inggris-1,False,0,0,False,sekolah.mu
1540,2,KELASMU,1,Sekolah Cikal-Kelas 9-Pendidikan Agama Hindu,,,Menggali nilai-nilai ajaran Yajna yang terkandung dalam Kitab Ramayana,,,"[{'id': 1335, 'subject_id': 80, 'subject_name': 'Agama Hindu'}]",[],,0.00,0.00,True,,"[{'id': 1743, 'tag': 'Murid', 'title': 'Murid'}, {'id': 1744, 'tag': 'Orangtua', 'title': 'Orangtua'}]",sekolah-cikal-kelas-9-pendidikan-agama-hindu,False,0,0,False,
1537,2,KELASMU,1,Sekolah Cikal-Kelas 1-Pendidikan Agama Hindu,,,"Mengenal Sabda, Bayu dan Idep sebagai kemampuan dasar yang dimiliki oleh kepada manusia",,,"[{'id': 1332, 'subject_id': 80, 'subject_name': 'Agama Hindu'}]",[],,0.00,0.00,True,,"[{'id': 1737, 'tag': 'Murid', 'title': 'Murid'}, {'id': 1738, 'tag': 'Orangtua', 'title': 'Orangtua'}]",sekolah-cikal-kelas-1-pendidikan-agama-hindu,False,0,0,False,
1531,2,KELASMU,1,Sekolah Cikal-TKA-Pendidikan Agama Hindu,,,Melaksanakan rangkaian kegiatan Hari Raya Nyepi,,,"[{'id': 1324, 'subject_id': 80, 'subject_name': 'Agama Hindu'}]",[],,0.00,0.00,True,,"[{'id': 1730, 'tag': 'Murid', 'title': 'Murid'}]",sekolah-cikal-tka-pendidikan-agama-hindu,False,0,0,False,Sekolah Cikal
1515,2,KELASMU,1,Agama Kristen Protestan Kelas IX SMP - Dinas Pendidikan Jakarta,https://d33sow78tsfzyk.cloudfront.net/upload/a510cc62a7f14241bdf2e13ee2b18226.jpeg,,Dalam program ini kawan murid akan belajar mengenai Pendidikan Agama Kristen & Budi Pekerti secara daring yang seru dan menyenangkan.,,,"[{'id': 1287, 'subject_id': 83, 'subject_name': 'Agama Kristen Protestan'}]","[{'id': 4555, 'tag': 'kelas 9', 'title': 'kelas 9'}, {'id': 4556, 'tag': 'PAK&BP', 'title': 'PAK&BP'}, {'id': 4557, 'tag': 'Pendidikan Agama Kristen', 'title': 'Pendidikan Agama Kristen'}]",<p>Program ini adalah Pendidikan Agama Kristen &amp; Budi Pekerti untuk kelas IX SMP yang diberikan agar siswa dapat belajar secara daring dan juga mendukung kegiatan pembelajaran jarak jauh yang bermakna.</p>,0.00,0.00,True,,"[{'id': 1692, 'tag': 'Murid', 'title': 'Murid'}]",agama-kristen-protestan-kelas-ix-smp-dinas-pendidikan-jakarta,False,0,0,False,sekolah.mu
1514,2,KELASMU,1,Bahasa Indonesia Kelas X SMA - Dinas Pendidikan Jakarta,https://d33sow78tsfzyk.cloudfront.net/upload/1073bbdd8598491087dcfa90236f3ff2.jpg,,Dalam program ini kawan murid akan memahami dan mengaplikasikan pengetahuan dalam membuat puisi.,,,"[{'id': 1286, 'subject_id': 90, 'subject_name': 'Bahasa Indonesia'}]","[{'id': 4552, 'tag': 'sma', 'title': 'sma'}, {'id': 4553, 'tag': 'kelas 10', 'title': 'kelas 10'}, {'id': 4554, 'tag': 'kelas x', 'title': 'kelas x'}]",<p>Program ini adalah pendidikan Bahasa Indonesia yang diberikan agar siswa dapat belajar secara daring dan juga untuk mendukung kegiatan pembelajaran jarak jauh yang bermakna.</p>,0.00,0.00,True,,"[{'id': 1691, 'tag': 'Murid', 'title': 'Murid'}]",bahasa-indonesia-kelas-x-sma-dinas-pendidikan-jakarta,False,0,0,False,Dinas Pendidikan Jakarta
1503,2,KELASMU,1,Bahasa Indonesia  Kelas VIII SMP - Dinas Pendidikan Jakarta,https://d33sow78tsfzyk.cloudfront.net/upload/5f91a6ef881a4ee7b084d3e3d742b80e.jpg,,Hallo Kawan murid. Dalam progam ini kawan murid akan belajar materi Bahasa Indonesia secara online dengan seru dan menyenangkan.,,4.83,"[{'id': 1277, 'subject_id': 90, 'subject_name': 'Bahasa Indonesia'}]","[{'id': 4541, 'tag': 'bahasa indonesia', 'title': 'bahasa indonesia'}, {'id': 4542, 'tag': 'kelas 8', 'title': 'kelas 8'}]",<p>Mata pelajaran dari progam ini adalah Bahasa Indonesia untuk kelas 8 SMP yang diberikan agar kawan murid dapat belajar secara daring serta dapat mendukung pembelajaran jarak jauh yang bermakna.</p>,0.00,0.00,True,,"[{'id': 1678, 'tag': 'Murid', 'title': 'Murid'}]",bahasa-indonesia-kelas-viii-smp-dinas-pendidikan-jakarta,False,0,0,False,Dinas Pendidikan
1461,2,KELASMU,1,Penjas-kelas 7-smpn125,,,Dalam program ini kalian,,,"[{'id': 1253, 'subject_id': 114, 'subject_name': 'Pendidikan IPS'}]",[],<p>Program sejarah kelas 7 di smpn 125</p>,0.00,0.00,True,,"[{'id': 1654, 'tag': 'Murid', 'title': 'Murid'}]",penjas-kelas-7-smpn125,False,0,0,False,Smpn 125
1455,2,KELASMU,1,PJOK Kelas XI SMA-Dinas Pendidikan Jakarta,https://d33sow78tsfzyk.cloudfront.net/upload/ea5047b6325c4197a1384c86a500681f.jpeg,,"Dalam program ini, kawan murid akan belajar mengenai gerakan berirama atau biasa disebut dengan senam. Penasaran kan? Yuk ikuti programnya!",,5.00,"[{'id': 1245, 'subject_id': 112, 'subject_name': 'Pendidikan Jasmani, Olahraga dan Kesehatan (PJOK)'}]","[{'id': 4525, 'tag': 'PJOK', 'title': 'PJOK'}, {'id': 4526, 'tag': 'SMA', 'title': 'SMA'}, {'id': 4527, 'tag': 'Kelas 11', 'title': 'Kelas 11'}]","<p>Halo kawan murid! Salam Olahraga.. Menjadi bugar adalah bagian dari proses mencintai diri sendiri sebagai bentuk rasa syukur kita terhadap pemberian tuhan atas tubuh yang kita miliki saat ini. Salah satu upaya untuk menjadi bugar adalah dengan berolahraga, kawan. Pernahkah kamu melakukan senam? Yak! Gerakan yang dilakukan sambil mengikuti irama ini sangat asyik dilakukan bersama-sama lho apalagi menyehatkan. Mari kita pelajari bersama mengenai gerakan-gerakannya yuk!</p>",0.00,0.00,True,,"[{'id': 1647, 'tag': 'Murid', 'title': 'Murid'}]",pjok-kelas-xi-sma-dinas-pendidikan-jakarta,False,0,0,False,Dinas Pendidikan
1452,2,KELASMU,1,IPA Kelas 7 SMP - Dinas Pendidikan Jakarta,https://d33sow78tsfzyk.cloudfront.net/upload/0578dc13875843d8b15e165ca363dee5.jpeg,,Dalam program ini kawan murid akan belajar mengenai Ilmu Pengetahuan Alam secara daring/online yang seru dan menyenangkan.,,3.33,"[{'id': 1243, 'subject_id': 113, 'subject_name': 'Pendidikan IPA'}]","[{'id': 4518, 'tag': 'ipa', 'title': 'ipa'}, {'id': 4519, 'tag': 'kelas 7', 'title': 'kelas 7'}]",<p>Program ini adalah IPA untuk kelas 7 SMP yang diberikan untuk siswa agar dapat belajar secara daring untuk mendukung kegiatan pembelajaran jarak jauh yang bermakna</p>,0.00,0.00,True,,"[{'id': 1643, 'tag': 'Murid', 'title': 'Murid'}]",ipa-kelas-7-smp-dinas-pendidikan-jakarta,False,0,0,False,sekolah.mu
1448,2,KELASMU,1,Matematika Kelas XI SMK - Dinas Pendidikan Jakarta,https://d33sow78tsfzyk.cloudfront.net/upload/300ab10f9563424aba02ba71bde0a860.jpeg,,"Program ini akan memaparkan materi matematika bagi siswa kelas XI SMK, serta terdapat kuis yang membuat belajar menjadi lebih menyenangkan. ",,5.00,"[{'id': 1236, 'subject_id': 111, 'subject_name': 'Matematika'}]","[{'id': 4516, 'tag': 'kelas 11', 'title': 'kelas 11'}, {'id': 4517, 'tag': 'SMK', 'title': 'SMK'}]",<p>Halo Kawan Murid! Selamat datang di program pembelajaran online Matematika Kelas &nbsp;XI SMK. Mari kita lakukan pembelajaran matematika yang menyenangkan di rumah.</p>,0.00,0.00,True,,"[{'id': 1637, 'tag': 'Murid', 'title': 'Murid'}]",matematika-kelas-xi-smk-dinas-pendidikan-jakarta,True,0,0,False,Dinas Pendidikan 
1445,2,KELASMU,1,Biologi Kelas X - SMA Negeri 33 Jakarta,https://d33sow78tsfzyk.cloudfront.net/upload/61357e81803c4adf895eef8b5579111f.png,,Tingkatkan kemampuan bernalar dan keterampilanmu pada mata pelajaran Biologi kelas X dan jadilah yang terbaik dan mudahkan jalan meraih asa.,,5.00,"[{'id': 1235, 'subject_id': 97, 'subject_name': 'Biologi'}]","[{'id': 4512, 'tag': 'Biologi Kelas X', 'title': 'Biologi Kelas X'}]",<p>Laman ini berisi materi pembelajaran Biologi kelas X. Terdapat 11 kompetensi dasar yang harus dicapai oleh setiap peserta didik kelas X.&nbsp;</p><p>Materi yang dibelajarkan pada ke-11 kompetensi dasar tersebut adalah:</p><ol><li>Ruang Lingkup Biologi</li><li>Keanekaragaman Hayati di Indonesia dan Upaya Pelestariannya</li><li>Klasifikasi Makhluk Hidup</li><li>Virus</li><li>Bakteri</li><li>Protista</li><li>Jamur</li><li>Tumbuhan</li><li>Hewan</li><li>Komponen Ekosistem dan Interaksi Antar Komponen Ekosistem</li><li>Perubahan Lingkungan.</li></ol><p>Diharapkan para pengguna laman ini dapat mencapai semua kompetensi dasar yang terdapat pada pembelajaran Biologi kelas X ini. Semangat dan Sukses Selalu.</p>,550000.00,0.00,True,,[],bioxsman33jkt,False,0,0,False,SMA Negeri 33 Jakarta
1438,2,KELASMU,1,Sekolah Cikal - TK B (Sample),,,Program Sekolah Cikal - TK B ini merupakan program yang menawarkan pembelajaran untuk anak usia dini berusia 5-6 tahun. ,,4.33,"[{'id': 1223, 'subject_id': 91, 'subject_name': 'Bahasa Inggris'}, {'id': 1224, 'subject_id': 90, 'subject_name': 'Bahasa Indonesia'}, {'id': 1225, 'subject_id': 111, 'subject_name': 'Matematika'}, {'id': 1226, 'subject_id': 113, 'subject_name': 'Pendidikan IPA'}, {'id': 1227, 'subject_id': 114, 'subject_name': 'Pendidikan IPS'}, {'id': 1228, 'subject_id': 117, 'subject_name': 'Seni Budaya dan Prakarya'}, {'id': 1229, 'subject_id': 112, 'subject_name': 'Pendidikan Jasmani, Olahraga dan Kesehatan (PJOK)'}]",[],"<p>Dalam program ini terdapat beberapa mata pelajaran untuk menunjang proses belajar anak pada usia ini, yaitu Matematika, Bahasa Indonesia, Bahasa Inggris, Ilmu Pengetahuan Sosial, Ilmu Pengetahuan Alam, Seni Budaya dan Prakarya, dan Pendidikan Jasmani, Olahraga dan Kesehatan.</p>",0.00,0.00,True,,"[{'id': 1622, 'tag': 'Murid', 'title': 'Murid'}, {'id': 1623, 'tag': 'Orangtua', 'title': 'Orangtua'}, {'id': 1624, 'tag': 'Guru', 'title': 'Guru'}]",sekolah-cikal-tk-b-1,False,0,0,False,Sekolah Cikal
1430,4,PRAKERJA,1,Digital Marketing,https://d33sow78tsfzyk.cloudfront.net/upload/a416564c74a64a378722ed0e5179460f.jpg,,Pasarkan produk atau jasa kamu di media sosial! Dapatkan cara cepat dan tepat dalam mengenalkan serta  menjual produk/jasa kamu di internet.,,5.00,"[{'id': 1211, 'subject_id': 126, 'subject_name': 'Media & Komunikasi'}, {'id': 1212, 'subject_id': 108, 'subject_name': 'Literasi Media'}, {'id': 1214, 'subject_id': 122, 'subject_name': 'Digital & Teknologi'}, {'id': 1215, 'subject_id': 125, 'subject_name': 'Desain & Seni'}, {'id': 1216, 'subject_id': 107, 'subject_name': 'Kreatif'}, {'id': 1300, 'subject_id': 98, 'subject_name': 'Bisnis Layanan'}, {'id': 1312, 'subject_id': 99, 'subject_name': 'Bisnis Manajemen'}, {'id': 1313, 'subject_id': 100, 'subject_name': 'Ekonomi'}]","[{'id': 4467, 'tag': 'marketing', 'title': 'marketing'}, {'id': 4468, 'tag': 'digital', 'title': 'digital'}, {'id': 4469, 'tag': 'think.web', 'title': 'think.web'}, {'id': 4470, 'tag': 'online', 'title': 'online'}]","<p>Mampu menggunakan media digital secara maksimal untuk kebutuhan marketing dengan pengetahuan dasar marketing: pemahaman produk, pengenalan dan analisa target market serta pembuatan dasar ide komunikasi.</p><p>Pemahaman dasar ini dapat dipergunakan untuk kamu yang ingin menjadi digital marketer, memasarkan barang/jasa secara digital atau berencana untuk membuka bisnis digital. &nbsp;Diakhir kelas para peserta akan memiliki pengetahuan dasar digital marketing.</p>",299000.00,199000.00,True,digit0010011000038147001,"[{'id': 1604, 'tag': 'Prakerja', 'title': 'Prakerja'}, {'id': 1605, 'tag': 'Profesional', 'title': 'Profesional'}, {'id': 1606, 'tag': 'Mahasiswa', 'title': 'Mahasiswa'}, {'id': 1607, 'tag': 'Orangtua', 'title': 'Orangtua'}, {'id': 1608, 'tag': 'Murid', 'title': 'Murid'}]",digital-marketing-1,False,0,0,False,Think.Web
1428,2,KELASMU,1,Sosiologi Kelas XI SMA-Dinas Pendidikan Jakarta,,,Pada program ini kawan murid akan belajar tentang hal yang sangat penting untuk dipelajari yaitu Integrasi dan Reintegrasi Sosial.,,4.57,"[{'id': 1210, 'subject_id': 129, 'subject_name': 'Sosiologi'}]","[{'id': 4463, 'tag': 'Sosiologi', 'title': 'Sosiologi'}, {'id': 4464, 'tag': 'SMA', 'title': 'SMA'}, {'id': 4465, 'tag': '11 IPS', 'title': '11 IPS'}, {'id': 4466, 'tag': 'kelas 11', 'title': 'kelas 11'}]","<p>Dalam program kali ini kawan murid akan mempelajari mengenai pengertian integrasi dan desintegrasi sosial, jenis-jenis integrasi soasial serta bentuk-bentuk integrasi sosial. Tidak hanya itu saja kawan, kita juga akan mempelajari tentang faktor pendorong integrasi sosial. Dalam Kamus Besar Bahasa Indonesia (KBBI) disebutkan bahwa integrasi adalah pembauran sesuatu yang tertentu hingga menjadi kesatuan yang utuh dan bulat. Lalu bagaimana keterkaitannya dengan hubungan sosial? Apakah ketika manusia sebagai mahkluk sosial berkonflik, integrasi dan desintegrasi sosial ini berpengaruh? untuk menemukan jawabannya, langsung saja yuk kita pelajari lebih lanjut!</p>",0.00,0.00,True,,"[{'id': 1603, 'tag': 'Murid', 'title': 'Murid'}]",sosiologi-kelas-xi-sma-dinas-pendidikan-jakarta,False,0,0,False,Dinas Pendidikan
1426,2,KELASMU,1,Pendidikan Agama Islam dan Budi Pekerti Kelas XI SMK - Dinas Pendidikan Jakarta,https://d33sow78tsfzyk.cloudfront.net/upload/f7ae86272590489b83c2622ed1b4e505.jpeg,,"Assalamualaikum, Kawan Murid! Selamat datang di program pembelajaran Agama Islam dan Budi Pekerti secara daring untuk Kelas XI SMK.",,,"[{'id': 1208, 'subject_id': 84, 'subject_name': 'Agama Islam'}]",[],,0.00,0.00,True,,"[{'id': 1601, 'tag': 'Murid', 'title': 'Murid'}]",pendidikan-agama-islam-dan-budi-pekerti,False,0,0,False,Dinas Pendidikan
1316,2,KELASMU,1,SMA Kelas 10 (Geografi) - Dinas Pendidikan DKI,https://www.sekolah.mu/wp-content/uploads/2020/03/gambar-kls-10-sma.jpeg,,Di pembelajaran geografi kali ini kita akan mempelajari tentang hidrosfer dan pengaruhnya bagi kehdupan ,,4.58,"[{'id': 1153, 'subject_id': 102, 'subject_name': 'Geografi'}]",[],<p>Menganalisis dinamika&nbsp; hidrosfer dan dampaknya &nbsp; terhadap kehidupan</p>,0.00,0.00,True,,"[{'id': 1566, 'tag': 'Murid', 'title': 'Murid'}]",sma-ips-kelas-10-geografi-dinas-pendidikan-dki,False,0,0,False,Dinas Pendidikan DKI
1315,4,PRAKERJA,1,Membuat Dashboard Laporan Interaktif Dengan Excel,https://d33sow78tsfzyk.cloudfront.net/upload/faae4be14a764e258da8484bd90250b3.jpg,https://d33sow78tsfzyk.cloudfront.net/upload/e7c47f0a21fa4f408d8d3b40d3b49eb0.jpg,Menggunakan Excel dengan baik dan membuat laporan lebih ringkas dan sederhana dalam bentuk dashboard yang menarik dan interaktif,,5.00,"[{'id': 1152, 'subject_id': 122, 'subject_name': 'Digital & Teknologi'}]","[{'id': 4404, 'tag': 'Digital Teknologi', 'title': 'Digital Teknologi'}, {'id': 4408, 'tag': 'Fresh Graduate', 'title': 'Fresh Graduate'}]","<p>Mampu menggunakan Microsoft Excel pada dunia kerja dewasa ini adalah sebuah keharusan. Microsoft Excel merupakan program aplikasi yang secara khusus diperuntukkan untuk mengolah sebuah informasi yang sifatnya statistik, perhitungan, pengolahan data, pembuatan laporan dan lain sebagainya.&nbsp;</p><p>Untuk itu, di kelas ini para peserta akan mampu menggunakan Microsoft Excel dengan baik dan tepat, dan utamanya mampu membuat laporan dengan sekumpulan data yang besar dan kompleks, sehingga menjadi laporan yang lebih ringkas dan sederhana dalam bentuk dashboard yang menarik dan interaktif.</p>",0.00,350000.00,True,membu0010052001069150569,"[{'id': 1563, 'tag': 'Prakerja', 'title': 'Prakerja'}, {'id': 1564, 'tag': 'Mahasiswa', 'title': 'Mahasiswa'}, {'id': 1565, 'tag': 'Profesional', 'title': 'Profesional'}]",membuat-dashboard-laporan-interaktif-dengan-excel,False,1000,985,False,G2 ACADEMY
1314,2,KELASMU,1,SMP Kelas 7 IPS - Dinas Pendidikan DKI,https://www.sekolah.mu/wp-content/uploads/2020/03/kelas-7-smp.jpeg,,IPS Program belajar dari Dinas Pendidikan DKI akan belajar beragam fenomena sosial yang ada di permukaan bumi dan di lingkungan sekitar  ,,4.79,"[{'id': 1151, 'subject_id': 114, 'subject_name': 'Pendidikan IPS'}]","[{'id': 4403, 'tag': 'Program Disdik', 'title': 'Program Disdik'}]","<p>Pada program pendidikan IPS ini, kita akan bersama-sama mempelajari asal usul nenek moyang bangsa Indonesia dan mencari tahu manusia purba yang pertama kali ada di Indonesia</p>",0.00,0.00,True,,"[{'id': 1562, 'tag': 'Murid', 'title': 'Murid'}]",smp-kelas-7-ips,False,0,0,False,Dinas Pendidikan DKI
1310,2,KELASMU,1,Bahasa Indonesia Kelas IX SMP - Dinas Pendidikan DKI,https://www.sekolah.mu/wp-content/uploads/2020/03/kelas-9-smp.jpeg,,Halo Kawan Murid. Selamat datang di program pembelajaran Bahasa Indonesia Kelas IX. Mari kita lakukan pembelajaran menyenangkan di rumah.,,,"[{'id': 1144, 'subject_id': 90, 'subject_name': 'Bahasa Indonesia'}]","[{'id': 4399, 'tag': 'Program Disdik', 'title': 'Program Disdik'}, {'id': 4400, 'tag': 'SMP', 'title': 'SMP'}]",,0.00,0.00,True,,"[{'id': 1551, 'tag': 'Murid', 'title': 'Murid'}]",bahasa-indonesia-kelas-ix-smp-dinas-pendidikan-dki,False,0,0,False,Dinas Pendidikan DKI
1307,2,KELASMU,1,Pendidikan Agama Islam dan Budi Pekerti Kelas VIII SMP - DInas Pendidikan DKI,https://www.sekolah.mu/wp-content/uploads/2020/03/kelas-8-smp.jpeg,,Halo Kawan Murid. Selamat datang di program pembelajaran Agama Islam Kelas VIII. Mari lakukan pembelajaran yang menyenangkan di rumah.,,3.50,"[{'id': 1125, 'subject_id': 62, 'subject_name': 'Pendidikan Agama'}, {'id': 1126, 'subject_id': 84, 'subject_name': 'Agama Islam'}]","[{'id': 4391, 'tag': 'Program Disdik', 'title': 'Program Disdik'}, {'id': 4392, 'tag': 'SMP', 'title': 'SMP'}]",,0.00,0.00,True,,[],pendidikan-agama-islam-dan-budi-pekerti-kelas-viii-smp-dinas-pendidikan-dki,False,0,0,False,Dinas Pendidikan DKI
1306,2,KELASMU,1,Biologi XI SMA MIPA - Dinas Pendidikan DKI,https://www.sekolah.mu/wp-content/uploads/2020/04/Logo-Disdik-11-SMA.jpeg,,Selamat datang di Program Pembelajaran Online Biologi Kelas 11 SMA IPA Dinas Pendidikan DKI! ,,4.84,"[{'id': 1112, 'subject_id': 97, 'subject_name': 'Biologi'}]","[{'id': 4389, 'tag': 'Program Disdik', 'title': 'Program Disdik'}, {'id': 4390, 'tag': 'SMA/MA', 'title': 'SMA/MA'}]",<p>Program ini berisi materi biologi Kelas XI SMA Semester 2. Mari lakukan kegiatan pembelajaran yang menyenangkan dari rumah.</p>,0.00,0.00,True,,"[{'id': 1545, 'tag': 'Murid', 'title': 'Murid'}]",biologi-xi-sma-mipa-dinas-pendidikan-dki,False,0,0,False,Dinas Pendidikan DKI
1305,2,KELASMU,1,Fisika Kelas X SMA - Dinas Pendidikan Jakarta,https://d33sow78tsfzyk.cloudfront.net/upload/4ab793c129454967aaaa1de515103949.jpeg,,"Dalam program ini, kawan murid akan mempelajari tentang Momentum, Impuls, dan hubungan keduanya serta Hukum Kekekalan Momentum. Skuy!!!",,,"[{'id': 1111, 'subject_id': 101, 'subject_name': 'Fisika'}]","[{'id': 4386, 'tag': 'Momentum', 'title': 'Momentum'}, {'id': 4387, 'tag': 'Impuls', 'title': 'Impuls'}, {'id': 4388, 'tag': 'Kekekalan momentum', 'title': 'Kekekalan momentum'}]","<p>Hai Kawan Murid!</p><p>Apakah kamu pernah melihat sebuah mobil balap yang sedang melaju kencang? Atau sebuah mobil truck yang bermuatan penuh melaju dengan kecepatan sedang? Mana yang lebih sulit dihentikan? Apabila keduanya bertabrakan, mana yang paling rusak? Nah, untuk mengetahui jawabannya kita akan mempelajarinya dalam program kali ini tentang Momentum, Impuls, dan hubungan keduanya serta Hukum Kekekalan Momentum. Setelah mempelajari BAB ini, kamu akan menemukan berbagai macam kasus dalam kehidupan sehari-hari yang berhubungan dengan momentum dan impuls. Seru bukan?</p>",0.00,0.00,True,,"[{'id': 1544, 'tag': 'Murid', 'title': 'Murid'}]",fisika-kelas-x-sma-dinas-pendidikan-jakarta,False,0,0,False,Dinas Pendidikan
1304,2,KELASMU,1,Kelas PAUD TK A – Dinas Pendidikan DKI,https://www.sekolah.mu/wp-content/uploads/2020/03/program-dinas-pendidikan.png,https://www.sekolah.mu/wp-content/uploads/2020/03/program-dinas-pendidikan.png,"Halo Ibu, Ayah, dan anak-anak! Selamat datang di pembelajaran online pertama kami di PAUD Disdik! 
",,,[],[],"<p>&nbsp;</p><figure class=""image""><img src=""https://www.sekolah.mu/wp-content/uploads/2020/03/kolabo-03-1-1024x724.png"" alt="""" srcset=""https://www.sekolah.mu/wp-content/uploads/2020/03/kolabo-03-1-1024x724.png 1024w, https://www.sekolah.mu/wp-content/uploads/2020/03/kolabo-03-1-300x212.png 300w, https://www.sekolah.mu/wp-content/uploads/2020/03/kolabo-03-1-768x543.png 768w, https://www.sekolah.mu/wp-content/uploads/2020/03/kolabo-03-1-1536x1086.png 1536w, https://www.sekolah.mu/wp-content/uploads/2020/03/kolabo-03-1-2048x1448.png 2048w, https://www.sekolah.mu/wp-content/uploads/2020/03/kolabo-03-1-400x283.png 400w, https://www.sekolah.mu/wp-content/uploads/2020/03/kolabo-03-1-100x70.png 100w, https://www.sekolah.mu/wp-content/uploads/2020/03/kolabo-03-1-540x382.png 540w, https://www.sekolah.mu/wp-content/uploads/2020/03/kolabo-03-1-860x608.png 860w, https://www.sekolah.mu/wp-content/uploads/2020/03/kolabo-03-1-1170x827.png 1170w, https://www.sekolah.mu/wp-content/uploads/2020/03/kolabo-03-1-600x424.png 600w"" sizes=""100vw"" width=""394""></figure><p>Halo, teman-teman TK A! Selamat datang di Kelas ini. Di sini kalian akan melakukan pembelajaran dari rumah. Mari kita lakukan pembelajaran yang menyenangkan di rumah bersama ibu dan ayah. Program ini didukung oleh Disdik DKI Jakarta, Pemprov DKI Jakarta, Sekolah Cikal, Sekolahmu, dan Semua Murid Semua Guru. Selamat bereksplorasi!</p><h3>Program ini didukung oleh:</h3><p><strong>Penulis Program: </strong>Riezkha Amalia Hanum dan tim (Sekolah Cikal), Shabrina Nur Amalina dan tim (Sekolah Cikal).</p><figure class=""image""><img src=""https://www.sekolah.mu/wp-content/uploads/2020/03/2018-0-12_17-51-39.jpg.png"" alt="""" srcset=""https://www.sekolah.mu/wp-content/uploads/2020/03/2018-0-12_17-51-39.jpg.png 200w, https://www.sekolah.mu/wp-content/uploads/2020/03/2018-0-12_17-51-39.jpg-150x150.png 150w, https://www.sekolah.mu/wp-content/uploads/2020/03/2018-0-12_17-51-39.jpg-100x100.png 100w"" sizes=""100vw""></figure><figure class=""image""><img src=""https://www.sekolah.mu/wp-content/uploads/2019/11/Logo-SekolahMu.png"" alt="""" srcset=""https://www.sekolah.mu/wp-content/uploads/2019/11/Logo-SekolahMu.png 500w, https://www.sekolah.mu/wp-content/uploads/2019/11/Logo-SekolahMu-300x300.png 300w, https://www.sekolah.mu/wp-content/uploads/2019/11/Logo-SekolahMu-150x150.png 150w, https://www.sekolah.mu/wp-content/uploads/2019/11/Logo-SekolahMu-380x380.png 380w, https://www.sekolah.mu/wp-content/uploads/2019/11/Logo-SekolahMu-100x100.png 100w"" sizes=""100vw""></figure><figure class=""image""><img src=""https://www.sekolah.mu/wp-content/uploads/2019/12/Logo-Cikal-1-1024x1024.png"" alt="""" srcset=""https://www.sekolah.mu/wp-content/uploads/2019/12/Logo-Cikal-1-1024x1024.png 1024w, https://www.sekolah.mu/wp-content/uploads/2019/12/Logo-Cikal-1-300x300.png 300w, https://www.sekolah.mu/wp-content/uploads/2019/12/Logo-Cikal-1-150x150.png 150w, https://www.sekolah.mu/wp-content/uploads/2019/12/Logo-Cikal-1-768x768.png 768w, https://www.sekolah.mu/wp-content/uploads/2019/12/Logo-Cikal-1-1536x1536.png 1536w, https://www.sekolah.mu/wp-content/uploads/2019/12/Logo-Cikal-1-2048x2048.png 2048w, https://www.sekolah.mu/wp-content/uploads/2019/12/Logo-Cikal-1-380x380.png 380w, https://www.sekolah.mu/wp-content/uploads/2019/12/Logo-Cikal-1-540x540.png 540w, https://www.sekolah.mu/wp-content/uploads/2019/12/Logo-Cikal-1-860x860.png 860w, https://www.sekolah.mu/wp-content/uploads/2019/12/Logo-Cikal-1-1170x1170.png 1170w, https://www.sekolah.mu/wp-content/uploads/2019/12/Logo-Cikal-1-100x100.png 100w, https://www.sekolah.mu/wp-content/uploads/2019/12/Logo-Cikal-1-600x600.png 600w"" sizes=""100vw""></figure><figure class=""image""><img src=""https://www.sekolah.mu/wp-content/uploads/2020/03/440px-Coat_of_arms_of_Jakarta.svg_.png"" alt="""" srcset=""https://www.sekolah.mu/wp-content/uploads/2020/03/440px-Coat_of_arms_of_Jakarta.svg_.png 440w, https://www.sekolah.mu/wp-content/uploads/2020/03/440px-Coat_of_arms_of_Jakarta.svg_-266x300.png 266w"" sizes=""100vw""></figure><figure class=""image""><img src=""https://www.sekolah.mu/wp-content/uploads/2020/03/WhatsApp-Image-2020-03-15-at-01.46.17.jpeg"" alt="""" srcset=""https://www.sekolah.mu/wp-content/uploads/2020/03/WhatsApp-Image-2020-03-15-at-01.46.17.jpeg 548w, https://www.sekolah.mu/wp-content/uploads/2020/03/WhatsApp-Image-2020-03-15-at-01.46.17-294x300.jpeg 294w, https://www.sekolah.mu/wp-content/uploads/2020/03/WhatsApp-Image-2020-03-15-at-01.46.17-540x552.jpeg 540w"" sizes=""100vw""></figure>",0.00,0.00,True,,"[{'id': 1538, 'tag': 'Murid', 'title': 'Murid'}, {'id': 1539, 'tag': 'Orangtua', 'title': 'Orangtua'}, {'id': 1540, 'tag': 'Guru', 'title': 'Guru'}]",kelas-paud-disdik-tk-a,False,0,0,False,Dinas Pendidikan
1303,2,KELASMU,1,Seni Budaya Kelas VIII SMP - Dinas Pendidikan Jakarta,https://d33sow78tsfzyk.cloudfront.net/upload/86f0e185f602450b83b6326df722b20f.jpeg,,Hallo Kawan murid. Dalam progam ini kawan murid akan belajar mengenai seni budaya dan prakarya secara online dengan seru dan menyenangkan.,,,"[{'id': 1105, 'subject_id': 117, 'subject_name': 'Seni Budaya dan Prakarya'}]","[{'id': 4381, 'tag': 'seni budaya', 'title': 'seni budaya'}, {'id': 4382, 'tag': 'seni budaya dan prakarya', 'title': 'seni budaya dan prakarya'}, {'id': 4383, 'tag': 'kelas 10', 'title': 'kelas 10'}]",<p>Mata pelajaran dari progam ini adalah Seni Budaya dan &nbsp;Prakarya untuk kelas 8 SMP yang diberikan agar kawan murid dapat belajar secara daring serta dapat mendukung pembelajaran jarak jauh yang bermakna.</p>,0.00,0.00,True,,"[{'id': 1537, 'tag': 'Murid', 'title': 'Murid'}]",seni-budaya-kelas-viii-smp-dinas-pendidikan-jakarta,False,0,0,False,Dinas Pendidikan Jakarta
